{"kind":"galadriel_producer_event","schema_version":"2.0","ncp_version":"1.0","contract_hash":"163acc57d8a62b66","session_id":"uav3","producer_id":"crebain","event_seq":8,"event":{"type":"modality_outcome","data":{"fusion_seq":41,"fusion_timestamp_ms":1700000000000,"frame_id":17,"context_id":23,"prior_id":29,"track_id":42,"modality":"radar","attempt_index":0,"measurement_index":3,"outcome":"updated","v1_expected":true,"candidate_count":2,"in_gate_count":1,"gate_evidence":{"method":"mahalanobis","d2":2.5,"threshold":7.815},"consistency_projection":{"values":[1.0,-2.0,0.0],"dimensions":2,"frame_id":17,"context_id":23,"prior_id":29}}}}
